status,Historical,Sports,Romance,Supernatural,Scifi,Comedy,Yuri,Yaoi,SliceofLife,Harem,Josei,Fantasy,Horror,Smut,Shoujo,Lolicon,ShoujoAi,Ecchi,Tragedy,Adult,Mystery,ShounenAi,Shotacon,genres,Drama,Mature,MartialArts,Action,Seinen,GenderBender,Adventure,title,Shounen,Psychological,Mecha,synopsis,num_vol,baka_url,SchoolLife,Hentai,Doujinshi
Complete,0,0,1,1,0,1,0,0,0,1,0,0,0,0,0,0,0,1,0,0,0,0,0,"Action, Comedy, Ecchi, Harem, Romance, Seinen, Supernatural",0,0,0,1,1,0,0,Gion no Tsugai,0,0,0,"In the land of Gion, the capital of Japan, a mysterious ""divine power"" has brought about great prosperity. It is a power that only brings about changes in girls in the form of turning them half-animal, a sign that they are servants to a god, as well as granting them great power. Some that are strong enough become Onmyou and fight evil. Others whose power have gone berserk become Orochi, fated to bring death and destruction to man. It was once thought that those who became Orochi had to be slain with no hope of saving the helpless victim—until a mysterious young man named Gion appeared to save one such girl. Will he be strong enough to fight the Orochi and bring an end to their terror?! ",2,http://www.mangaupdates.com/series.html?id=119944,0,0,0
Complete,0,0,1,1,0,1,0,0,1,1,0,0,0,0,0,0,0,0,0,0,0,0,0,"Comedy, Drama, Harem, Romance, SchoolLife, Shounen, SliceofLife, Supernatural",1,0,0,0,0,0,0,Gift - Under the Rainbow,1,0,0,"It is based off of the ero-game entitled Gift (ギフト). Gift is a story that revolves around high school student Haruhiko Amami and his strong connection to the mysterious power that surrounds the town of Narasaki.  It has two distinguishing characteristics: a rainbow that seems permanently fixed in the sky no matter the weather, and an ability known as Gift possessed by all its inhabitants. Gift's power can only be evoked by each person once in a lifetime, and is able to grant a single miracle. To be successful, a Gift must reflect the shared feelings of both the giver and the receiver. If the feelings are not mutual, the Gift is distorted and has the ability to wreak havoc on the surrounding area. When this happens, a black streak appears in the rainbow above town until Gift is used correctly. The story begins as Haruhiko's younger sister, Riko Fukamine, returns home after several years away. Beginning with her appearance, Haruhiko's life starts to change very quickly and feelings of the past begin to surface once more. ",2,http://www.mangaupdates.com/series.html?id=11259,1,0,0
Complete,1,0,1,0,0,0,0,0,0,1,0,0,0,0,0,0,0,0,0,1,0,0,0,"Adult, Drama, Harem, Historical, Romance, Seinen",1,0,0,0,1,0,0,Genji Monogatari (EGAWA Tatsuya),0,0,0,N/A ,7,http://www.mangaupdates.com/series.html?id=5187,0,0,0
Complete,0,0,1,0,0,1,0,0,0,1,0,0,0,0,0,0,0,0,0,1,0,0,0,"Adult, Comedy, Harem, Romance, Seinen",0,0,0,0,1,0,0,Ghost Writer,0,0,0,"Mikage Tarou is a poor 25-year-old writer with a secret: He's the ghost writer behind an author that has recently become wildly popular, Nagareboshi Ryuusei. Since Tarou's ghost writing is strictly confidential, everyone he knows believes that he's something of a failure. His personal life doesn't make him look very successful either, as he didn't acquire a very prestigious education and he's never slept with a woman. His publishing company doesn't treat him with much respect, and he's always behind on his apartment rent. His personal life is looking more interesting lately, though. He has a thing for his landlord, an innocent and pretty young woman named Mabayu, and his sexy, uninhibited neighbor Hikaru keeps causing all sorts of awkward situations. Will Mikage ever be able to attain any kind of public success, and will he ever end up with Mabayu? ",2,http://www.mangaupdates.com/series.html?id=65695,0,0,0
Complete,1,0,0,0,0,0,0,0,0,1,0,0,0,0,1,0,0,0,0,0,0,0,0,"Harem, Historical, Shoujo",0,0,0,0,0,0,0,Geten no Hana,0,0,0,"From : Hotaru Kunoichi of the Iga Village has accepted a request to infiltrate Oda Nobunaga’s castle, Aduchi Castle. Under the guise that she is the younger sister of Mitsuhide, Nobunaga's confidante, she investigates the Oda army for dissenters. Hotaru deepens her relations with great military commanders, from Nobunaga to Hashiba Hideyoshi and Tokugawa Ieyasu. However, it will all be over if they find out who she truly is . . . ",3,http://www.mangaupdates.com/series.html?id=95683,0,0,0
Ongoing,0,0,1,0,0,1,0,0,0,1,0,1,0,0,0,0,0,0,0,0,0,0,0,"Action, Adventure, Comedy, Drama, Fantasy, Harem, Romance, Shounen",1,0,0,1,0,0,1,Genjitsushugisha no Oukokukaizouki,1,0,0,"“O, Hero!” With that cliched line, Kazuya Souma found himself summoned to another world and his adventure-- did not begin. After he presents his plan to strengthen the country economically and militarily, the king cedes the throne to him and Souma finds himself saddled with ruling the entire nation! What’s more, he’s betrothed to the king’s daughter now?! In order to get the country back on its feet, Souma calls the wise, the talented, and the gifted to his side.Five people gather before the newly crowned Souma. Just what are the many talents and abilities they possess… What path will his outlook as a realist take Souma and the people of his country down? A revolutionary transferred-to-another-world administrative fantasy series starts here! ",0,http://www.mangaupdates.com/series.html?id=143762,0,0,0
Complete,0,0,0,0,0,0,0,0,0,1,0,0,0,0,0,0,0,0,0,1,0,0,0,"Adult, Harem, Seinen",0,0,0,0,1,0,0,Geigeki Shoutengai,0,0,0,N/A ,2,http://www.mangaupdates.com/series.html?id=63795,0,0,0
Complete,0,0,0,0,0,1,0,0,1,1,0,0,0,0,1,0,0,0,0,0,0,0,0,"Comedy, Harem, SchoolLife, Shoujo, SliceofLife",0,0,0,0,0,0,0,GDGD-DOGS,0,0,0,"Tezuka Kanna, 15, is a girl who loves manga. For that reason, she specifically enrolls in a course for manga in Tokiwa High School as a freshman! No one knows though, that she is already a debuting manga artist. ...But wait, what's this?! Three handsome guys suddenly appear, and what's more they know!!! Kanna (God) vs. Those Guys (Devils)!!! What would happen next?! ",3,http://www.mangaupdates.com/series.html?id=55340,1,0,0
Complete,0,0,1,0,0,1,0,0,0,1,0,0,0,0,1,0,0,0,0,0,0,0,0,"Comedy, Harem, Romance, Shoujo",0,0,0,0,0,0,0,Gaya!,0,0,0,N/A ,2,http://www.mangaupdates.com/series.html?id=8795,0,0,0
Complete,0,0,1,1,0,0,0,0,0,1,0,0,0,0,1,0,0,0,0,0,0,0,0,"Harem, Romance, SchoolLife, Shoujo, Supernatural",0,0,0,0,0,0,0,Garnet Cradle - Gekkou no Aria,0,0,0,"Amahashi Miku is a first year student at the elite Mifuta Academy and its a perfect one. Suddenly her life changes when she is chosen to play a role on the academy play. Soon a lot of events happen, including supernatural ones...and she even starts to have strange dreams with a unique black cat... ",3,http://www.mangaupdates.com/series.html?id=53035,1,0,0
Complete,0,0,1,0,0,0,0,0,0,1,0,0,0,0,0,0,0,1,0,0,0,0,0,"Drama, Ecchi, Harem, Romance, SchoolLife, Shounen",1,0,0,0,0,0,0,GE - Good Ending,1,0,0,"Good Ending follows the main character Utsumi's interactions with Kurokawa Yuki, a member of the school tennis team, in order for Utsumi to confess his feelings to the captain of the tennis team. It is implied that the title of the manga is derived from the ""good endings"" that are achieved in visual novels. ",16,http://www.mangaupdates.com/series.html?id=45881,1,0,0
Complete,0,0,0,0,0,0,0,0,0,1,0,0,0,0,0,0,0,0,0,0,0,1,0,"Drama, Harem, SchoolLife, ShounenAi",1,0,0,0,0,0,0,Gakuen Heaven - Revolution,0,0,0,"Itou Keita is a boy with no remarkable talents beyond his better-than-average luck, until one day he receives an acceptance letter out of the blue inviting him to attend the prestigious all-boys academy, Bell Liberty School (BL School). Why has he been admitted to this amazing academy, and how can he possibly live up to the expectations of whoever let him in? As he settles in to his new life, Keita is sure to find companionship in his rather eclectic cast of schoolmates. ",4,http://www.mangaupdates.com/series.html?id=68460,1,0,0
Complete,0,0,1,0,0,1,0,0,0,1,0,0,0,0,0,0,0,1,0,0,0,0,0,"Comedy, Ecchi, Harem, Romance, SchoolLife, Seinen",0,0,0,0,1,0,0,Gakuto no Vector,0,0,0,"Minazu Aruto loves reading novels and short stories so a classmate recommends a club that the school has called Philosophia. The classmate doesn't really know what the club is about but the name sparks a curiosity in Aruto and he decides to find out what it is. He goes to the old library on campus where he meets and is introduced to all three members of the group: Tomoe, Takaho and Kaede. Still without knowing what the Philosophia club is about, Aruto finds himself joining what he thinks is a literature club. ",1,http://www.mangaupdates.com/series.html?id=47126,1,0,0
Complete,0,0,1,0,0,0,0,0,0,1,0,0,0,0,0,0,0,0,0,1,0,0,0,"Adult, Harem, Hentai, Romance, SchoolLife",0,0,0,0,0,0,0,Gakuen Seikatsu - Boku to Sakura to Futari no Bishoujo,0,0,0,N/A ,1,http://www.mangaupdates.com/series.html?id=92615,1,1,0
Complete,0,0,0,0,0,0,0,0,0,1,0,1,0,0,0,0,0,0,0,0,0,0,0,"Fantasy, Harem, Seinen",0,0,0,0,1,0,0,Gate - Featuring the Starry Heavens,0,0,0,"The background story is the same as ""Gate - Thus the JSDF Fought There!"" expect the main females characters are up and coming Idols from the other side of the ""Gate"" and Itami is their manager. ",2,http://www.mangaupdates.com/series.html?id=120211,0,0,0
Complete,0,0,0,0,0,1,0,0,0,1,0,0,0,0,0,0,0,1,0,0,0,0,0,"Comedy, Ecchi, Harem, Psychological, SchoolLife, Shounen",0,0,0,0,0,0,0,Gamble Fish,1,1,0,"The story is set at Shishidou, a school attended by rich and elite people. Tomu Shirasagi, a gambler, is a mysterious new transfer student who has come from a public school (instead of a prestigious private one) and faces the elitist environment. There, he declares a challenge toward any student and claims he will bring to the ruin the whole school through a series of gambling matches. Nobody knows why he has come to that school or what the real motivations behind his actions are. During any match, Tomu shows off all of his unique coolness and ability. He employs a wide range of tricks, both psychological and physical, to ensure his victory. In any game, you will constantly ask how he's planning to win, why he's really doing certain things, and what's really going on. At the end of the matches, the tricks are revealed, and they all work in real life, even if they do require one to be highly skilled or lucky in order to perform them. The story centers around the various matches he undertakes and the interactions between the various characters, like Mika Shishidou, the beautiful granddaughter of the school headmaster, who is highly intelligent but contemptuous and superb, or Abidani, the vampiric looking dorm superintendent and main villain (for now) in the series, who has a sadistic personality and whose goal is to make Tomu leave his school (or to get him killed). As the story unfolds, more about Tomu's past is revealed, leading to unpredictable turns of events. ",19,http://www.mangaupdates.com/series.html?id=13188,1,0,0
Complete,0,0,1,0,1,1,0,0,0,1,0,1,0,0,0,0,0,1,0,0,0,0,0,"Action, Comedy, Ecchi, Fantasy, Harem, Romance, SchoolLife, Scifi, Seinen",0,0,0,1,1,0,0,Gakusen Toshi Asterisk,0,0,0,"The Academy City on water, ""Rikka"". This city, otherwise known as 'Asterisk', was famous for being the world's largest stage for the integrated battle entertainment <Star Wars Festival>. The young boys and girls of the <Starpulse Generation> belonging to the six academies made their wishes with Shining Armaments in their hands, vying for supremacy -- Amagiri Ayato is one of them. Ayato arrived at Rikka at the invitation of the Student Council President of the Seidoukan Academy, Claudia, and right after that he incurred the wrath of the <Petalblaze Witch> Julis, and ended up having to duel her. ",5,http://www.mangaupdates.com/series.html?id=90589,1,0,0
Complete,0,0,1,0,0,1,0,0,0,1,0,0,0,0,0,0,0,0,0,1,0,0,0,"Adult, Comedy, Harem, Romance, SchoolLife, Seinen",0,0,0,0,1,0,0,Gakuen Heaven,0,0,0,"Gakuen Heaven is the story of Oshino Makoto in his attempt to become a teacher, in order to fulfill a promise made to his childhood friend and first love Koiwai Ayano, who also promised that when they see each other again they will get married. Unfortunately, he fails miserably and ends up as a substitute teacher in an all-girls private school governed by his grandmother. He meets a lot of female students there, especially Narusawa Tsugum; as well as a teacher who resembles his long lost first love, Asagiri Ayano. He even becomes the love interest of the substitute principal, his cousin Kyoko. ",8,http://www.mangaupdates.com/series.html?id=105,1,0,0
Complete,0,0,1,0,0,1,0,0,0,1,0,0,0,1,1,0,0,0,0,0,0,0,0,"Comedy, Drama, Harem, Mature, Romance, SchoolLife, Shoujo, Smut",1,1,0,0,0,0,0,Gakuen Ouji,0,0,0,"The stage is set in the prestigious Private Joshi (girls) Oka High School, more commonly known as Joshi High. It became co-educational a few years ago, but females still heavily outnumber the males. So small is the number of men that it could be easily counted. While one would think guys would be pampered in such a harem school, the reality is far from heavenly. It is the world of female domination. ",12,http://www.mangaupdates.com/series.html?id=12466,1,0,0
Complete,0,0,0,0,0,0,0,0,0,1,0,1,0,0,0,0,0,0,0,1,0,0,0,"Adult, Fantasy, Harem, Hentai",0,0,0,0,0,0,0,Gakkou no Kairaku,0,0,0,N/A ,1,http://www.mangaupdates.com/series.html?id=47970,0,1,0
Complete,0,0,1,0,0,0,0,0,0,1,0,0,0,0,0,0,0,0,0,1,0,0,0,"Adult, Harem, Romance, SchoolLife, Seinen",0,0,0,0,1,0,0,Gakkou no Tantei,0,0,0,N/A ,4,http://www.mangaupdates.com/series.html?id=114819,1,0,0
Complete,0,0,1,0,0,1,0,0,0,1,0,0,0,0,0,0,0,1,0,0,0,0,0,"Comedy, Ecchi, GenderBender, Harem, Romance, Shounen",0,0,0,0,0,1,0,Gacha Gacha - Secret,1,0,0,"Hatsushiba Akira, an awkward high school senior boy, has a strong crush on classmate Sakuraba Yurika. But when he gets close to her, he always says or does something stupid. At the suggestion of his best friend, Kikuchi, Akira enters the GachaGacha machine to play a game, but the machine fritzes out and malfunctions. That night, he sneezes while going to bed, and when he wakes up, he looks like the female avatar he saw in the GachaX2. He soon learns that sneezing will change him back and forth from his normal self to a female form. As a girl, Akira-chan is able to get close to Sakuraba and to become her friend. ",11,http://www.mangaupdates.com/series.html?id=27751,0,0,0
Complete,0,0,1,0,0,1,0,0,0,1,0,0,0,0,0,0,0,1,0,0,0,0,0,"Comedy, Ecchi, Harem, Romance, Shounen",0,0,0,0,0,0,0,Gacha Gacha - Capsule,1,0,0,"Lately, Kouhei can't get his friend Kurara out of his mind. Even though he has known her since elementary school, all of a sudden, ever since she came back from summer vacation, he has been crushing on her... hard. But something is different about Kurara--she's acting very oddly. Sometimes she seems wholesome, pure, and innocent, and at other times she is extremely forward and unabashed. Kouhei soon learns that Kurara has multiple personalities--and decides to help her keep her secret from their classmates. But Kouhei finds himself struggling between helping Kurara as a friend and trying to win her heart... which is a challenge, since she has many! ",5,http://www.mangaupdates.com/series.html?id=27752,0,0,0
Complete,0,0,0,0,1,1,1,0,0,1,0,0,0,0,0,0,0,1,0,0,0,0,0,"Action, Comedy, Ecchi, Harem, Mature, SchoolLife, Scifi, Shounen, Yuri",0,1,0,1,0,0,0,G-on Riders,1,0,0,"At Saint Hoshikawa School there is a secret group called the G-On Riders. Students with superior strength and ability are chosen to be in the group, which was formed to fight against alien attacks on the earth. However, many of the problems that the members face are ones amongst themselves, and the same is true for the invaders. And another student at the school, Ichiro, tries despretly to confess his love to Yuki, one of the Riders. ",1,http://www.mangaupdates.com/series.html?id=5605,1,0,0
Complete,0,0,1,0,0,1,0,0,0,1,0,1,0,0,0,0,0,1,0,0,0,0,0,"Comedy, Ecchi, Fantasy, GenderBender, Harem, Romance, Shounen",0,0,0,0,0,1,0,Gacha Gacha,1,0,0,"Do not confuse with (aka: Gatcha Gacha). For the specific arcs (and their associated releases), look under the ""Related Series"" field. PART ONE - (VOLUME 1-5) Nanjou Kouhei and Hanazono Clara have been childhood friends since elementary, and now in their high school years, Kouhei has begin to take a liking for his childhood friend. However, after an uneventful summer vacation, Clara began to act differently. Sometimes turning extremely ""horny"" while becoming pure and innocent at other times. Soon, due to certain ""accidents"", Kouhei is forced to help our Clara whenever she ""changes"". What will become of Kouhei's high school life as he tries to help his friend and win her heart? PART TWO - (VOLUME 6-16) Hatsushiba Akira, an awkward senior highschool boy, has a strong crush on classmate Sakuraba Yurika. But when he gets close to her he always says or does something stupid. At the suggestion of his best friend, Kikuchi, Akira enters the GachaGacha machine to play a game, but the machine fritzes out and malfunctions. That night he sneezes while going to bed, and when he wakes up he looks like the female avatar he saw in the GachaX2. He soon learns that sneezing will change him back and forth from his normal self to a female form. As a girl, Akira-chan is able to get close to Sakuraba and become her friend. ",16,http://www.mangaupdates.com/series.html?id=44,0,0,0
Ongoing,0,0,1,0,0,1,0,0,1,1,0,0,0,0,0,0,0,0,0,0,0,0,0,"Comedy, Drama, Harem, Psychological, Romance, SchoolLife, SliceofLife",1,0,0,0,0,0,0,Futsuu ni Naritai,0,1,0,"Fukatsu Michitaka, a boy who just became a high school student, can't differentiate people at all because of his prosopagnosia (Face blindness). However one day he runs into a girl whose face looks completely different than the rest. So in order to cure his illness and accomplish his dream of becoming ""normal,"" he starts to get close to her. ",34,http://www.mangaupdates.com/series.html?id=143176,1,0,0
Complete,0,0,0,0,0,0,0,0,0,1,0,0,0,0,0,0,0,0,0,1,0,0,1,"Adult, Harem, Hentai, Shotacon",0,0,0,0,0,0,0,Fuwatoro Jusei Chuudoku!,0,0,0,1. Kitty Cafe in Heat 2. Tanetsuke Tokutaisei (Breeding Scholarship) 3. Shiritsu Maid Gakuen! (Private Maid Academy!) 4. Welcome to the Tanezuke Dormitory 5. Sister's Pact 6. Topping Angels 7. Merry Kozukuri! (Merry Baby Making!) 8. First Time Debauchery 9. Anal Until Marriage Extra Toranoana Bonus Booklet ,1,http://www.mangaupdates.com/series.html?id=140773,0,1,0
Complete,0,0,1,0,0,1,0,0,0,1,0,1,0,0,0,0,0,1,0,0,0,0,0,"Action, Comedy, Drama, Ecchi, Fantasy, Harem, Mecha, Romance",1,0,0,1,0,0,0,Fuuun Ishin Daishogun,0,0,1,N/A ,1,http://www.mangaupdates.com/series.html?id=111771,0,0,0
Ongoing,0,0,0,0,0,1,0,0,0,1,0,1,0,0,0,0,0,1,0,0,0,0,0,"Action, Adventure, Comedy, Ecchi, Fantasy, Harem, Mature, Shounen",0,1,0,1,0,0,1,Futoku no Guild,1,0,0,"Kikuru Madan, a monster hunter with excellent performance, because of his particular job in the forest, He decided to quit his job because of fear wasting his own youth. The reason he want to quit because one of his friend married. One day there is a new recruiter. Enome the Guild recepcionist-girl asking Him to accompany Hitamu Kyan the Lolipai Martial-Artist to keep her save in the back and teach her how to work. So He decided for accept the request. The reason behind, he worried about her and the other half he wanted to make her became successor before he retire completely. Sadly his plan to retire overthrow with Hitamu uselessness and always attract some monster. However, Can Kikuru Madan retire peacefully, with the presence of some useless newbies recruitment? ",0,http://www.mangaupdates.com/series.html?id=144434,0,0,0
Complete,0,0,1,0,0,1,0,0,0,1,0,0,0,0,0,0,0,0,0,1,0,0,0,"Adult, Comedy, Harem, Romance, Seinen",0,0,0,0,1,0,0,Futarigurashi (KAKIMOTO Kenjirou),0,0,0,"Futarigurashi follows an aspiring mangaka named Kenji Aoyama, when he meets a boy named Hikaru Saitou. However it turns out that ""he"" is actually a girl who was raised as a boy. ",13,http://www.mangaupdates.com/series.html?id=69331,0,0,0
Complete,0,0,1,0,0,0,0,0,0,1,0,0,0,0,0,0,0,0,0,1,0,0,0,"Adult, Harem, Romance, Seinen",0,0,0,0,1,0,0,Futari to Hitori no Renai Kouryaku,0,0,0,N/A ,2,http://www.mangaupdates.com/series.html?id=113864,0,0,0
Complete,0,0,0,0,0,1,0,1,0,1,0,0,0,0,0,0,0,0,0,0,0,0,0,"Comedy, Harem, Yaoi",0,0,0,0,0,0,0,Chou yo Hana yo (WATANABE Asia),0,0,0,"From : Lately Tamao has been finding the pink nipples of his cute and slutty papa, Kouzuki, irresistible. On his 20th birthday, his papa tells him that they aren't really father and son. Well, of course they DO IT, don't they? ",1,http://www.mangaupdates.com/series.html?id=17413,0,0,0
Complete,0,0,0,0,0,0,0,0,0,1,0,0,0,0,0,0,0,0,0,1,0,0,0,"Adult, Harem, Hentai",0,0,0,0,0,0,0,Chou Onee-san Tengoku,0,0,0,"From : The story of an incredibly well hung guy who finds himself living with three women. It's got anal, gang, peeing, NTR, S&M, but all done in a pretty humorous way. There are also dramatic turns to the story. ",7,http://www.mangaupdates.com/series.html?id=57649,0,1,0
Complete,0,0,1,0,1,1,0,0,0,1,0,0,0,0,0,0,0,1,0,0,0,0,0,"Action, Comedy, Drama, Ecchi, Harem, Mecha, Romance, Scifi, Shounen",1,0,0,1,0,0,0,Chojuu Kishin Dancouga Burn,1,0,1,Group of soldiers fighting against aliens after the conquest of the planet Earth. ,2,http://www.mangaupdates.com/series.html?id=30848,0,0,0
Complete,0,0,1,1,0,1,0,0,0,1,0,0,0,0,0,0,0,1,0,0,0,0,0,"Action, Comedy, Ecchi, Harem, Romance, Shounen, Supernatural",0,0,0,1,0,0,0,Chou Dokyuu Shoujo 4946,1,0,0,"With his phrase ""don't you dare make girls cry,"" Makoto Tobita has failed his 30th confession, but that won't stop him. Promising to do anything for the girl who smiles at him, no matter what it is, what will happen now when the alien fighting - giant girl, Mana Eimiya, is in love with him? ",6,http://www.mangaupdates.com/series.html?id=42464,0,0,0
Complete,0,0,1,0,0,1,0,0,0,1,0,0,0,0,0,0,0,1,0,0,0,0,0,"Comedy, Ecchi, Harem, Mature, Romance, SchoolLife, Seinen",0,1,0,0,1,0,0,"Chikotan, Kowareru",0,0,0,Miyahara Chiko is a mysterious girl who never seems to talk to anyone and always wears a pair of headphones and a scarf. But what is she hiding behind that silent facade? ,7,http://www.mangaupdates.com/series.html?id=123071,1,0,0
Complete,0,0,1,0,0,1,0,0,0,1,0,0,0,0,0,0,0,0,0,1,0,0,0,"Adult, Comedy, Harem, Romance, Seinen",0,0,0,0,1,0,0,Chika >< Chika,0,0,0,N/A ,1,http://www.mangaupdates.com/series.html?id=48739,0,0,0
Ongoing,0,0,0,0,0,0,0,0,0,1,0,0,0,0,0,0,0,0,0,1,0,0,1,"Adult, Harem, Hentai, Shotacon",0,0,0,0,0,0,0,El toiu Shoujo no Monogatari,0,0,0,N/A ,6,http://www.mangaupdates.com/series.html?id=130048,0,1,0
Complete,0,0,1,1,0,1,0,0,0,1,0,0,0,0,0,0,0,1,0,0,0,0,0,"Action, Comedy, Ecchi, Harem, Romance, Shounen, Supernatural",0,0,0,1,0,0,0,Eighth,1,0,0,Eighth Research is a large biotech company based on advanced research and development of DNA manipulation. Naoya Graphico is on the security team for the company run by his uncle. Naoya has been acknowledged for his high combat skills and is sent on top secret missions regarding Eighth Research interests. His most recent task has Naoya infiltrating a rival company where a mysterious girl named Celcia has been kidnapped. Naoya's passion for protecting the weak always helps him accomplish missions; he just needs to make sure his libido doesn't get in the way. ,16,http://www.mangaupdates.com/series.html?id=46349,0,0,0
Complete,0,0,1,1,0,0,0,0,0,1,0,1,0,0,1,0,0,0,0,0,0,0,0,"Action, Drama, Fantasy, Harem, Romance, Shoujo, Supernatural",1,0,0,1,0,0,0,Eien Kamoshirenai,0,0,0,"From : Kosumo has a serious medical condition that has kept her in the hospital ever since she was a child. Since Kosumo's blood type is rare, it impossible to find a donor. While Kosumo is on the verge of death, out in the city, the 99th Generation Miko, Himiko-sama, gets into a terrible accident while trying to save a child. She is rushed to the hospital, and there her fate crosses with Kosumo's. When the hospital discovers that Himiko has the same rare blood type as Kosumo, they decide to make her a donor, since Himiko is sure to die as a result of the accident. Kosumo recovers and moves back to Tokyo, but later finds out that Himiko's blood isn't the only thing flowing inside her… ",8,http://www.mangaupdates.com/series.html?id=2943,0,0,0
Complete,0,0,1,0,0,1,0,0,0,1,0,0,0,0,0,0,0,1,0,0,0,0,0,"Comedy, Ecchi, Harem, Mature, Romance, SchoolLife, Shounen",0,1,0,0,0,0,0,Eiken,1,0,0,"Zashono Academy is unique in all the world. It has 54,000 students and this allows for some VERY specialized clubs. There are clubs for just about everything you can think of... and then there's the Eiken club. No one seems to know just what it's about, but they do know that it's filled with some of the most bodacious babes ever to be brought together! ...and then there's Densuke. Densuke is a little awkward and clumsy and he always seems to be in the most compromising positions with all the other club members. And all he really wants is to be with the cutest girl on campus, the lovely Chiharu. Will he ever be able to get away from the uncomfortable club activities and let Chiharu know what's really on his mind? ",18,http://www.mangaupdates.com/series.html?id=4703,1,0,0
Ongoing,0,0,1,0,0,1,0,0,0,1,0,0,0,0,0,0,0,1,0,0,0,0,0,"Comedy, Ecchi, Harem, Mature, Romance, SchoolLife, Seinen",0,1,0,0,1,0,0,Egokoro Toiro,0,0,0,N/A ,4,http://www.mangaupdates.com/series.html?id=95640,1,0,0
