status,Historical,Sports,Romance,Supernatural,Scifi,Comedy,Yuri,Yaoi,SliceofLife,Harem,Josei,Fantasy,Horror,Smut,Shoujo,Lolicon,ShoujoAi,Ecchi,Tragedy,Adult,Mystery,ShounenAi,Shotacon,genres,Drama,Mature,MartialArts,Action,Seinen,GenderBender,Adventure,title,Shounen,Psychological,Mecha,synopsis,num_vol,baka_url,SchoolLife,Hentai,Doujinshi
Complete,0,0,0,0,0,0,0,0,0,1,0,0,0,0,0,0,0,0,0,1,0,0,0,"Adult, GenderBender, Harem, Hentai",0,0,0,0,0,1,0,Super Taboo XXX,0,0,0,Incest oneshots English rewrite of Yawaraka Daisharin changing character backgrounds to make their relationship seem incestous. ,5,http://www.mangaupdates.com/series.html?id=47702,0,1,0
Complete,0,0,0,0,0,0,0,0,0,1,0,0,0,0,0,0,0,0,0,1,0,0,0,"Adult, GenderBender, Harem, Hentai",0,0,0,0,0,1,0,Super Taboo,0,0,0,"Various incest related stories, partly interconnected by same characters. English rewrite (changing character background from stepsiblings to blood-related siblings, as well as changing their ages) of Super Family Complex and Super Family Complex Kanketsuhen by Ogami Wolf. ",12,http://www.mangaupdates.com/series.html?id=47701,0,1,0
Complete,0,0,0,1,0,0,0,0,0,1,0,0,0,0,0,0,0,0,0,1,0,0,0,"Adult, Harem, Hentai, Supernatural",0,0,0,0,0,0,0,Triple Sunshine,0,0,0,1-3. Triple Sunshine 4. TsumogaMIX 5. Otherworld Kanaka 6. Suntanned Memories ,1,http://www.mangaupdates.com/series.html?id=26898,0,1,0
Ongoing,0,0,1,0,0,1,0,0,0,1,0,0,0,0,0,0,0,1,0,0,0,0,0,"Comedy, Ecchi, Harem, Romance, Seinen",0,0,0,0,1,0,0,Sunoharasou no Kanrinin-san,0,0,0,"Shiina Aki is constantly being treated like a girl due to his feminine looks so he decides to move to Tokyo and attend middle school in an attempt to change himself. However what awaits him in his new home, Sunohara-sou, is the kind-hearted caretaker, Sunohara Ayaka and three female members of Aki's new middle school's student council, named Yukimoto Yuzu, Yamanashi Sumire, and Kazami Yuri. And so begins Aki's new life of living with four girls in Tokyo. ",3,http://www.mangaupdates.com/series.html?id=110602,0,0,0
Complete,0,0,0,1,0,1,0,0,0,1,0,1,0,0,0,0,0,0,0,0,0,0,0,"Action, Comedy, Drama, Fantasy, Harem, Shounen, Supernatural",1,0,0,1,0,0,0,Ushio to Tora,1,0,0,"It centers around the travels and battles of one Aotsuki Ushio, who is constantly being stalked and aided by a gigantic, supernatural and sometimes invisible tiger (Some people describe it as akin to Calvin and Hobbes on acid). Ushio's family maintains a Shinto temple in Japan, where 500 years ago, his samurai ancestor battled that same tiger to a standstill, and eventually trapped him against a rock using, a blessed spear called the ""Beast Spear"", which in addition to its intrinsic formidability as a weapon, can also boost the physical powers of the user. While cleaning out the temple storage, Ushio accidentally unseals the chamber which Tora was trapped in. Initially, Ushio wisely refused to remove the spear pinning Tora (とら, Japanese for tiger) down, as Tora unwisely makes the strategic blunder of mentioning that the first thing he would do upon being freed would be to devour Ushio; but Tora's unsealed presence attracts various demons to the premises, and Ushio is forced to free Tora in exchange for his help. The series focuses on their relationship, interspersed with battles against mythological foes, and with Tora's attempts to grapple with modern life and gobble up Ushio. Won the Seiun Award for Best Comic of the Year in 1997.  It also received the Shogakukan Manga Award for shounen in 1992. ",33,http://www.mangaupdates.com/series.html?id=9801,0,0,0
Complete,0,0,1,1,0,1,0,0,0,1,0,0,0,0,0,0,0,0,0,1,0,0,0,"Adult, Comedy, Harem, Romance, Seinen, Supernatural",0,0,0,0,1,0,0,Yakusai Kochou,0,0,0,"Unlucky student meets a girl that offers to exorcise a bad spirit possessing him, and from then on they go to solve many spiritual cases (almost always involving nudity) - although she tends to screw up more often than she succeeds. ",4,http://www.mangaupdates.com/series.html?id=44402,0,0,0
Complete,0,0,1,0,0,1,0,0,1,1,0,1,0,0,0,0,0,1,0,0,1,0,0,"Comedy, Ecchi, Fantasy, GenderBender, Harem, Mystery, Romance, SchoolLife, Shounen, SliceofLife",0,0,0,0,0,1,0,Yamada-kun to 7-nin no Majo,1,0,0,"Ryuu Yamada is a second-year student at Suzaku High. Ryuu is always late for school, naps in class and gets abysmal grades. His life is a dead bore. The beautiful Urara Shiraishi, on the other hand, is Suzaku High's brightest student. One day, without explanation, their bodies are swapped! Ryuu ends up in Urara's body, and Urara in Ryuu's. ",28,http://www.mangaupdates.com/series.html?id=74942,1,0,0
Complete,0,0,0,0,0,0,0,0,0,1,0,0,0,0,0,0,0,0,0,1,0,0,0,"Adult, Harem, Hentai",0,0,0,0,0,0,0,Yadokari Sisters,0,0,0,N/A ,1,http://www.mangaupdates.com/series.html?id=77901,0,1,0
Complete,0,0,1,0,0,0,0,0,0,1,1,0,0,1,0,0,0,0,0,0,0,0,0,"Harem, Josei, Romance, Smut",0,0,0,0,0,0,0,Yajuu Sheik to Dorei Keiyaku Shimashita.,0,0,0,N/A ,1,http://www.mangaupdates.com/series.html?id=141153,0,0,0
Complete,1,0,1,0,0,0,0,0,0,1,0,0,0,0,1,0,0,0,0,0,0,0,0,"Adventure, Harem, Historical, Romance, Shoujo",0,0,0,0,0,0,1,Ya-ya-yah ga Yatte Kuru!,0,0,0,"In the Taishou era, there was a girl named Kinako who loved to sing. However, her parents forbid her to sing, and forced her into an engagement! While running away from her engagement, she fainted. During the time she was unconscious, she traveled through time. She wakes up and finds herself in the modern age, where she is confronted by a group of rising idols?! ",2,http://www.mangaupdates.com/series.html?id=3271,0,0,0
Complete,0,0,1,0,0,0,0,0,0,1,0,1,0,0,0,0,0,1,0,0,0,0,0,"Action, Adventure, Ecchi, Fantasy, Harem, Romance, SchoolLife, Seinen",0,0,0,1,1,0,1,Yagate Maken no Alicebell,0,0,0,"From : Seiji Harada usually avoids girls due to the fact that he believes that they are the source of all problems. As he enters his high school years, he is forced to join an all-girl school that recently began admitting male students. Now surrounded by all girls, he begins to realize that all members of this high school possess special powers, including himself. [DrCoke] ",3,http://www.mangaupdates.com/series.html?id=109887,1,0,0
Complete,1,0,0,0,0,0,0,0,0,1,0,0,0,0,0,0,0,0,0,0,0,0,0,"Action, Drama, Harem, Historical, Mature, Seinen",1,1,0,1,1,0,0,Y十M,0,0,0,"From Del Rey: In 17th century Japan, a rebellion in the Aizu territory has been brutally crushed, leaving twenty-one brave warriors dead and most of the nuns of the local convent slaughtered. Now the surviving nuns have sworn to seek revenge. ",11,http://www.mangaupdates.com/series.html?id=2985,0,0,0
Complete,0,0,1,0,0,1,1,0,0,1,0,0,0,0,0,0,0,0,0,1,0,0,0,"Action, Adult, Comedy, Harem, Romance, SchoolLife, Seinen, Yuri",0,0,0,1,1,0,0,Wrestle! The Under Ground,0,0,0,"The organization known as “Gigant” has sent one of their best men to kill a cute young high school girl. However, the assassin seems reluctant… Why did he get these strange orders? What’s the secret behind that girl? ",4,http://www.mangaupdates.com/series.html?id=49938,1,0,0
Ongoing,0,0,0,0,0,0,0,0,0,1,0,0,0,0,0,0,0,0,0,1,0,0,0,"Adult, Harem, Hentai",0,0,0,0,0,0,0,Wotome Haha,0,0,0,1. Wotome Haha (をとめはは); 2. Wotome Haha 1 Kouhen (をとめはは 第1話 後編); 3. Wotome Haha 2 (をとめはは 第2話); 4. Wotome Haha 3 (をとめはは 第3話); 5. Wotome Haha 4 (をとめはは 第4話);  ,0,http://www.mangaupdates.com/series.html?id=131706,0,1,0
Complete,0,0,0,0,0,1,0,0,1,1,0,0,0,0,0,0,0,0,0,0,0,0,0,"Comedy, Harem, SliceofLife",0,0,0,0,0,0,0,Wooser no Sono Higurashi,0,0,0,N/A ,2,http://www.mangaupdates.com/series.html?id=84725,0,0,0
Ongoing,0,0,1,0,0,1,0,0,0,1,0,1,0,0,0,0,0,0,0,0,0,0,0,"Action, Adventure, Comedy, Drama, Fantasy, Harem, Romance, SchoolLife, Shounen",1,0,0,1,0,0,1,World Teacher - Isekaishiki Kyouiku Agent,1,0,0,"A man who was once called the world strongest agent ended up becoming a teacher after his retirement to train the new generation of agents. After many years of training his disciples, he is killed at the age of 60 by the ploy of a secret organization and was reincarnated in another world with all his past memories. Though he was surprised by the magic and the strange species of that world, he adapted very fast to his condition as a newborn and took advantage of it. He acquired special magic and gained a massive amount of strength thanks to his tight discipline, in order to reach his goal: Resume his career as a teacher which he left halfway through in his previous life. This is the story of a man, who, based on the memories and the experiences of his previous life, became a teacher who travels through the world with his students. ",2,http://www.mangaupdates.com/series.html?id=137811,1,0,0
Ongoing,0,0,0,0,0,0,0,0,0,1,0,1,0,0,0,0,0,0,0,0,0,0,0,"Action, Adventure, Drama, Fantasy, Harem, MartialArts, Shounen",1,0,1,1,0,0,1,Wortenia Senki,1,0,0,"High school student Mikoshiba Ryouma was summoned to a different world in the middle of a war. Sensing the malice from the one who summoned him (a summoner of the O'ltormea empire), he uses his martial arts to run away, killing important people of the empire during his escape. After the escape, he rescues two twin sisters from the hands of thieves. The sisters who can use magic, swear to serve him as subordinates. Thus, Ryouma begins his journey on the path of the supreme ruler. /  ",2,http://www.mangaupdates.com/series.html?id=140719,0,0,0
Complete,0,0,0,0,0,0,0,0,0,1,0,0,0,0,0,0,0,0,0,1,0,0,0,"Adult, Harem, Hentai, SchoolLife",0,0,0,0,0,0,0,Wonderful Days - 17-nin no Shojo to Inu,0,0,0,1. Shinjou Kensaku 2. Futari Yogari 3-7. Wonderful Days 8. Sweet Devil 9. Kousei Shoujo ,1,http://www.mangaupdates.com/series.html?id=119989,1,1,0
Complete,0,0,0,0,0,0,0,0,0,1,0,0,0,0,0,0,0,0,0,1,0,0,0,"Adult, Drama, Harem, SchoolLife, Shounen",1,0,0,0,0,0,0,Wonder Rabbit Girl,1,0,0,"Nanami Rei has always lived his life in his brother's shadow. He can't talk to girls, he's not athletic, and his grades aren't good. On the contrary, his brother Ren is smart and popular, but he has never judged Rei for his faults or lifestyle. One day, Ren goes into shock and mentions to Rei the name, ""Wonder Rabbit Girl"". Rei, seeking to find this mysterious figure, attends Ren's school, disguised as Ren himself. Rei comes into possession of his brother's USB drive, which contains a list of the school's girls and their fetishes. Rei believes that one of these girls must be the Wonder Rabbit Girl. ",7,http://www.mangaupdates.com/series.html?id=121341,1,0,0
Ongoing,0,0,1,0,1,0,0,0,0,1,0,0,0,0,0,0,0,1,0,0,0,0,0,"Drama, Ecchi, Harem, Mature, Romance, Scifi, Shounen",1,1,0,0,0,0,0,World's End Harem,1,0,0,"In the year 2040, Japan has advanced technologically to the point of no longer needing people to work. However the cure for some diseases, such as multiple sclerosis, has not been discovered—people who have this disease have to stay cryogenized for 5 years to receive the cure. What was not expected when they woke up, was that they are the only hope for humanity to survive. ",4,http://www.mangaupdates.com/series.html?id=133060,0,0,0
Complete,0,0,0,1,0,0,0,0,0,1,0,0,0,0,0,0,0,0,0,1,0,0,0,"Adult, Harem, Hentai, Supernatural",0,0,0,0,0,0,0,Witchcraft,0,0,0,Our protagonist is a wimp who one day tries to stand up to the bullies constantly picking on him.. At which point his courage fails him and he quickly retreats to the nearest place to hide - A fortuneteller who wants to test her powers of hypnosis.   Can our hero manage to stand up to his bullies? Can our fortuneteller manage to test her hypnosis? ,1,http://www.mangaupdates.com/series.html?id=14829,0,1,0
Complete,0,0,1,0,0,0,0,0,0,1,0,0,0,0,0,0,0,0,0,0,0,0,0,"Harem, Romance, SchoolLife, Seinen",0,0,0,0,1,0,0,Wind - A Breath of Heart,0,0,0,"Makoto was born in Kazune city, but was forced to move away with his sister Hinata and Minamo’s family after his father’s death. As children, the three played together. When his family moves for the second time, he entrusted to Minamo a harmonica. The two pinky-swore to meet again and marry some day. The game begins four years later. Makoto and Hinata are returning to Kazune via train and enroll at High School where he is reunited with Minamo. He learns that many people of the city have special powers which only they can do. For example, Hinata can jump higher than most 2-story buildings, Minamo can control the wind, Nozomi can create shockwaves with edged weapons, and Wakaba can cure wounds and slow down diseases. The town is also home to a long series of murders and mysterious disappearances. When Minamo’s father Professor Akihito tries to research the city’s mysteries to understand what caused these powers to develop, a chain of events begins and in the game it is the player’s goal to help Makoto uncover these mysteries while forging bonds with one of the five girls. ",1,http://www.mangaupdates.com/series.html?id=20281,1,0,0
Complete,0,0,1,0,0,0,0,0,0,1,0,0,0,0,0,0,0,0,0,1,0,0,0,"Adult, Drama, Harem, Romance, Seinen",1,0,0,0,1,0,0,Wild Honey World,0,0,0,N/A ,3,http://www.mangaupdates.com/series.html?id=78174,0,0,0
Complete,1,0,1,0,0,0,0,0,0,1,0,1,0,0,1,0,0,0,0,0,1,0,0,"Fantasy, Harem, Historical, Mystery, Romance, Shoujo",0,0,0,0,0,0,0,Will o' Wisp,0,0,0,"Based on the Victorian-goth otome girl's game. Hanna inherited her grandfather’s ability to make “elemental dolls,” but he forbade her to do that after she made her first doll, her maid Emily. After he died however, Hanna discovered a strange male “elemental doll” called Will in the basement of her grandfather’s workshop. Who made Will and for what purpose? Why is he calling her “master” and are there others like him? These are only a few of the mysteries Hanna has to solve. ",2,http://www.mangaupdates.com/series.html?id=38940,0,0,0
Complete,0,0,1,0,0,0,0,0,0,1,0,0,0,0,0,0,0,0,0,0,0,0,0,"Drama, Harem, Romance, Shounen",1,0,0,0,0,0,0,White Album (ABENO Chako),1,0,0,"Touya now has a new girlfriend, Yuki Morikawa--but before they enter college she is going to debut as an idol. How will this new development affect their relationship? What about the current idol, Rina Ogata, who seems to have set her sights on Touya? ",3,http://www.mangaupdates.com/series.html?id=31394,0,0,0
Complete,0,0,1,0,0,0,0,0,0,1,0,0,0,0,0,0,0,0,0,1,0,0,0,"Adult, Harem, Hentai, Romance",0,0,0,0,0,0,0,Watashitte Eroi n desu.,0,0,0,1. Watashi tte Eroi n desu. (I'm So Naughty) 2. Meshibe (Pistil) 3. Kashin (Petal) 4. Kamitsu (Nectar) 5. Oshibe (Stamen) 6. Ryouran (Profusion) 7. Vanilla 8. Private Time 9. Graduate From~ 10-11. Chain Reaction ,1,http://www.mangaupdates.com/series.html?id=28355,0,1,0
Complete,0,0,0,0,0,0,0,0,0,1,0,0,0,0,0,0,0,0,0,1,0,0,0,"Adult, Harem, Hentai",0,0,0,0,0,0,0,"Watashi wa Hoka no Otoko to, Sex Shite, Sex Shite, Sex o Shita. - Itsu no Mani ka Kanojo wa",0,0,0,N/A ,1,http://www.mangaupdates.com/series.html?id=116889,0,1,0
Complete,0,0,0,0,0,0,0,0,0,1,0,0,0,0,0,0,0,0,0,1,0,0,0,"Adult, Harem, Hentai, SchoolLife",0,0,0,0,0,0,0,Watashi No Oshikko Fubunritsu,0,0,0,N/A ,1,http://www.mangaupdates.com/series.html?id=134491,1,1,0
Complete,0,0,0,0,0,0,0,0,0,1,0,0,0,0,0,0,0,0,0,1,0,0,0,"Adult, Harem, Hentai",0,0,0,0,0,0,0,Watashi ni Mawashite Ura Kairanban,0,0,0,N/A ,1,http://www.mangaupdates.com/series.html?id=121401,0,1,0
Complete,0,0,0,0,0,0,0,0,0,1,0,0,0,0,0,0,0,0,0,1,0,0,0,"Adult, Harem, Hentai",0,0,0,0,0,0,0,Wanpaku Girls,0,0,0,N/A ,1,http://www.mangaupdates.com/series.html?id=92459,0,1,0
Complete,0,0,1,0,0,1,0,0,0,1,0,0,0,0,1,0,0,0,0,0,0,0,0,"Comedy, Harem, Romance, SchoolLife, Shoujo",0,0,0,0,0,0,0,Watashi ga Motete Dousu n da,0,0,0,"Serinuma Kae is a  chubby second-year high schooler and an avid fujoshi who secretly ships her classmates, Igarashi-kun and Nanashima-kun. The death of her favorite anime character causes her to become stressed and lose weight rapidly. Now that Serinuma has become an attractive girl to her classmates, her snarky kouhai Shinomiya-kun, and her senpai Mutsumi-senpai. How is she going to deal with them...with her constant BL-filled, fujoshi mind?! Won the 40th Kodansha Manga Award for Shoujo in 2016. ",14,http://www.mangaupdates.com/series.html?id=99100,1,0,0
Ongoing,0,0,1,0,0,0,0,0,0,1,0,0,0,0,0,0,0,0,0,0,0,0,0,"Drama, Harem, Romance, SchoolLife, Seinen",1,0,0,0,1,0,0,Watari-kun no xx ga Houkai Sunzen,0,0,0,"Ever since his parents died, Watari Nao's life has revolved around his little sister. He forgoes club activities for the sake of spending time with her, leading many of his peers to label him a siscon. But as long as his sister's happy, Nao is willing to shut out any unwelcome comments about himself. Unbeknownst to Nao, however, a greater danger has resurfaced - one that destroyed his way of life six years ago, and threatens to do so once again. And that danger, in the form of a girl wielding a garden hoe, will stop at nothing to reclaim what could once have been hers, and hers alone. ",5,http://www.mangaupdates.com/series.html?id=112785,1,0,0
Ongoing,0,0,1,0,0,1,0,0,0,1,0,0,0,0,0,0,0,1,0,0,0,0,0,"Comedy, Ecchi, Harem, Mature, Romance, SchoolLife, Seinen",0,1,0,0,1,0,0,Walkure Romanze - Shoujo Kishi Monogatari (NO. Gomesu),0,0,0,"In the Middle Ages, jousting was a duel between knights who put their prides on the line in an effort to take down their opponent in one sweeping blow. Even with the changing of time, jousting is still being done. In one country it has gone from ""duel"" to ""sport"" and everyone, girls as well, is encouraged to become knights and take up the sport. One girl, Celia, is no exception. It was through jousting that she met her first love, a jousting student named Takahiro in her youth. However, before she could talk with him, tragedy struck in the form of a jousting accident and he returned to his country before she could approach him. Years pass and Celia has become a strong young woman. Attending Winford Academy, she studies the art of jousting as well as how to become a knight. It is a new school year and she sees Takahiro among the new students. Will she be able to approach Takahiro this time? Will she become a knight? Only time will tell as the story unfolds. ",2,http://www.mangaupdates.com/series.html?id=92664,1,0,0
Complete,0,0,1,0,0,1,0,0,0,1,0,0,0,0,0,0,0,1,0,0,0,0,0,"Comedy, Ecchi, Harem, Romance, Shounen",0,0,0,0,0,0,0,Walkure Romanze - Shoujo Kishi Monogatari,1,0,0,"Walkure Romanze's story revolves around Takahiro Mizuno, a student studying at an academy with jousting as its main focus for sport. Takahiro acts as an advisor to the riders of the sport. Takahiro goes through each day tediously until the time of the annual competition draws near. Due to some odd circumstances, his childhood friend Mio Kisaki is enrolled into the competition. As she has never even rode a horse once in her life, Takahiro senses the fear in his friend and becomes Mio's coach. ",2,http://www.mangaupdates.com/series.html?id=72297,0,0,0
Complete,0,0,1,0,0,1,0,0,0,1,0,0,0,0,0,0,0,1,0,0,0,0,0,"Comedy, Ecchi, Harem, Romance, Seinen",0,0,0,0,1,0,0,Walkure Romanze - Noel Étoile,0,0,0,N/A ,1,http://www.mangaupdates.com/series.html?id=105082,0,0,0
Complete,0,0,0,0,0,1,0,0,0,1,0,0,0,0,0,0,0,0,0,1,0,0,0,"Adult, Comedy, Harem, Hentai",0,0,0,0,0,0,0,Wakuwaku Monzetsu Maison,0,0,0,1-8. Wakuwaku One-sans ,1,http://www.mangaupdates.com/series.html?id=121998,0,1,0
Ongoing,0,0,1,1,0,1,0,0,0,1,0,1,0,0,0,0,0,1,0,1,0,0,0,"Adult, Comedy, Ecchi, Fantasy, Harem, Romance, Shounen, Supernatural",0,0,0,0,0,0,0,"Wakamono no Kuro Mahou Hanare ga Shinkoku desu ga, Shuushoku shite Mitara Taiguu Iishi, Shachou mo Tsukaima mo Kawaikute Saikou desu!",1,0,0,Original title: 若者の黒魔法離れが深刻ですが、就職してみたら待遇いいし、社長も使い魔もかわいくて最高です! ,0,http://www.mangaupdates.com/series.html?id=145371,0,0,0
Complete,0,0,0,0,1,1,0,0,0,1,0,0,0,0,0,0,0,1,0,0,0,0,0,"Comedy, Ecchi, Harem, Mature, SchoolLife, Scifi, Seinen",0,1,0,0,1,0,0,Waga Tousou - Imouto no Tame nara Sekai o Shukusei Shite mo Ii yo ne!,0,0,0,"Mina, a Lieutenant of the Space-Time Vanguard Unit arrives from the distant future to interrupt Ichikawa's peaceful life with some upsetting news of how the world would end-up if he continues to pursue his affection about his little sister. The sound of the grim news doesn't seem though to deter Ichikawa resulting in Mina having to take any and every possible action to convince and if necessary seduce him! ",3,http://www.mangaupdates.com/series.html?id=102435,1,0,0
Ongoing,0,0,1,0,0,1,0,0,0,1,0,0,0,0,1,0,0,0,0,0,0,0,0,"Comedy, Harem, Romance, SchoolLife, Shoujo",0,0,0,0,0,0,0,Vitamin Z,0,0,0,N/A ,1,http://www.mangaupdates.com/series.html?id=48780,1,0,0
Complete,0,0,1,0,0,0,0,0,0,1,0,0,0,0,1,0,0,0,0,0,0,0,0,"Harem, Romance, Shoujo",0,0,0,0,0,0,0,Vitamin X,0,0,0,N/A ,1,http://www.mangaupdates.com/series.html?id=28754,0,0,0
Complete,0,0,1,1,1,1,0,0,0,1,0,0,0,0,0,0,0,0,0,0,0,0,0,"Comedy, Drama, Harem, Romance, SchoolLife, Scifi, Shounen, Supernatural",1,0,0,0,0,0,0,Wagatsuma-san wa Ore no Yome,1,0,0,"Aoshima Hitoshi is a second-year student in high school, who wishes he had a girlfriend. One day he wakes up for an unknown reason 10 years in the future, and he is married to the prettiest girl in school, Wagatsuma Ai! How has their relationship grown from mere acquaintances to husband and wife!? ",13,http://www.mangaupdates.com/series.html?id=69443,1,0,0
Complete,0,0,1,0,0,1,0,0,0,1,0,0,0,0,1,0,0,0,0,0,0,0,0,"Comedy, Harem, Romance, Shoujo",0,0,0,0,0,0,0,VitaminZ - Welcome Our New Supplement Boys,0,0,0,Manga adaptation of the otome game Vitamin Z. ,2,http://www.mangaupdates.com/series.html?id=40834,0,0,0
Complete,0,0,1,0,1,1,0,0,0,1,0,0,0,0,0,0,0,0,0,1,0,0,0,"Action, Adult, Comedy, Harem, Romance, SchoolLife, Scifi, Seinen",0,0,0,1,1,0,0,VITA Sexualis,0,0,0,"From : One day while Shirou was delivering a secret weapon to his colleague, he met Amane Mao, a super strong girl who is capable of lifting cars. Before they knew it, an ERROR, a monster that struck Old Tokyo 14 years ago, reappeared and started on a rampage. While he was arguing with his colleague over the use of the super weapon to save civilians, his colleague was blown away and died. Faced with death, Shirou had no choice but to combine with Mao with the super weapon and destroy the ERROR. ",6,http://www.mangaupdates.com/series.html?id=33885,1,0,0
Complete,0,0,1,1,0,1,0,0,0,1,0,0,0,0,1,0,0,0,0,0,0,0,0,"Comedy, Harem, Romance, SchoolLife, Shoujo, Supernatural",0,0,0,0,0,0,0,Virgin Wars,0,0,0,"Kanami's father has a debt of 300 million yen! He can either pay the money or sell his daughter, Kanami, to the sex industry. Kanami decides to go to the sex industry for the sake of her father. But before she does, she wants to have a normal life and lose her virginity normally. In the bathroom, she mistakenly stumbles across her classmate, Ryuuno, having sex with a girl. Later on at a gokun, she meets Ryuuno. She gets drunk and she wakes up to find herself in bed with Ryuuno. She doesn't fight back. When she wakes up later on, she sees Ryuuno (with his pants still on 0_o) injured very badly! Did Kanami do this? Does she have some hidden powers she doesn't know about? ",2,http://www.mangaupdates.com/series.html?id=7605,1,0,0
Complete,0,0,1,0,0,1,0,0,0,1,0,0,0,0,0,0,0,0,0,1,0,0,0,"Adult, Comedy, Harem, Hentai, Romance",0,0,0,0,0,0,0,Virginity - Shojo to Shuuchi to Juujun to,0,0,0,1. Motto Micha... iya 2. Mirarechau no... yada (I Don't Like... Being Seen) 3. Swimming Girls 4. Imouto Sannin Ani Hitori... de!? (A Boy And His Three Sisters) 5. Ore to Boku 6. Straight Girl 7. Give Me Your Love2 8. Mikoto no Honne (Mikoto's True Voice) 9. Souane CC (Twin Sister CC) 10. Kokuhaku mae to Kokuhaku ato (Confession Before And After) 11. Zoku Imouto Sannin Ani Hitori...de!? 12. Zoku Mirarechau no...yada ,1,http://www.mangaupdates.com/series.html?id=74670,0,1,0
Complete,0,0,0,0,0,0,0,0,0,1,0,0,0,0,0,0,0,0,0,1,0,0,0,"Adult, Harem, Hentai",0,0,0,0,0,0,0,Virgin na Kankei R,0,0,0,Preview contains spoilers from the prequel manga.   ,6,http://www.mangaupdates.com/series.html?id=23287,0,1,0
Complete,1,0,0,1,0,0,0,0,0,1,0,1,0,0,1,0,0,0,1,0,0,0,0,"Drama, Fantasy, Harem, Historical, Shoujo, Supernatural, Tragedy",1,0,0,0,0,0,0,Venomania Kou no Kyouki,0,0,0,"In the rural and peaceful Belzenia-Asmodin Empire, women of all ranks, ages, and marital statuses have begun disappearing one after the other. All they have in common is that they are both beautiful and reputable. Where have the stolen women disappeared to - and who will be targeted next? ",1,http://www.mangaupdates.com/series.html?id=81022,0,0,0
Complete,0,0,1,0,0,1,0,0,0,1,0,0,0,0,0,0,0,0,0,1,0,0,0,"Adult, Comedy, Harem, Romance, Seinen",0,0,0,0,1,0,0,Virgin Mama,0,0,0,"Kazuya is a 28 year-old divorced salaryman, who is convinced by his boss one night to go with him to a massage parlor. He does and meets a pretty young woman named Nagisa. He takes her card, but loses it when his aunt makes him help clean up the house in the front of the complex they live in (she's the landlord) so that a new boarder can come live with them. Of course, it's Nagisa, and her 5 children, from toddler to teenager. Her husband has died and she's doing everything she can to support these kids. Oh, and one more thing. She's only 21 years old, and may have never even consummated her marriage! ",20,http://www.mangaupdates.com/series.html?id=56773,0,0,0
