status,Historical,Sports,Romance,Supernatural,Scifi,Comedy,Yuri,Yaoi,SliceofLife,Harem,Josei,Fantasy,Horror,Smut,Shoujo,Lolicon,ShoujoAi,Ecchi,Tragedy,Adult,Mystery,ShounenAi,Shotacon,genres,Drama,Mature,MartialArts,Action,Seinen,GenderBender,Adventure,title,Shounen,Psychological,Mecha,synopsis,num_vol,baka_url,SchoolLife,Hentai,Doujinshi
Complete,0,0,1,0,0,1,0,0,0,1,0,0,0,0,0,0,0,0,0,1,0,0,0,"Adult, Comedy, Drama, Harem, Romance, Seinen",1,0,0,0,1,0,0,Renai Junkies,0,0,0,"From : Eitaro is hooked to the erotic chats... Someone steals Sakuko's lingerie... Ai is determined to lose her virginity... Everybody is hooked on love... or is it to sex?! An erotic manga by Kyo Hatsuki following the trials and sexual triumphs of the main character. The story travels from - ""Will he ever get laid?"" to - ""Will he ever get a steady girlfriend?"" to - ""Will he ever learn to keep it in his pants?!"" ",26,http://www.mangaupdates.com/series.html?id=1590,0,0,0
Complete,0,0,1,1,0,1,0,0,0,1,0,0,0,0,0,0,0,0,0,1,0,0,0,"Adult, Comedy, Harem, Hentai, Romance, Supernatural",0,0,0,0,0,0,0,Renai Akuma,0,0,0,"Masato can't get into college, and he can't get into his best friend, Megumi's pants.  Enter Maria, a sexy young devil ready, willing, and able to grant him any three wishes his heart desires ...in exchange for his soul! ",3,http://www.mangaupdates.com/series.html?id=33412,0,1,0
Ongoing,0,0,1,1,0,0,0,0,0,1,0,0,1,0,0,0,0,0,0,0,0,0,0,"Drama, Harem, Horror, Romance, SchoolLife, Shounen, Supernatural",1,0,0,0,0,0,0,Ren'ai Harem Game Shuuryou no Oshirase ga kuru Koro ni,1,0,0,"The ""academy love suspense"" story is about a ""love harem game"" set in a real academy that was promised to a boring boy. However, in this harem scenario, the heroines will start a bloody battle. ",2,http://www.mangaupdates.com/series.html?id=140873,1,0,0
Complete,0,0,1,0,0,0,0,0,0,1,0,1,0,0,1,0,0,0,0,0,0,0,0,"Fantasy, Harem, Romance, Shoujo",0,0,0,0,0,0,0,Real Rode,0,0,0,"From : Nina is popular, fashionable, and dating one of the coolest guys in school...  But no one knows that she's secretly crazy for video games!  When she's playing her favorite, Rode, for the hundredth time, something strange happens--she falls asleep, and wakes up to a cat telling her she's actually been transported to Rode!  It's all just a dream... right? ",1,http://www.mangaupdates.com/series.html?id=44466,0,0,0
Complete,0,0,1,0,0,1,0,0,0,1,0,0,0,0,1,0,0,0,0,0,0,0,0,"Comedy, Harem, Romance, Shoujo",0,0,0,0,0,0,0,Reajuu na Kanojo,0,0,0,"High School Student, Andou Kana is currently obsessed with a particular otome game called, Sumakon. But what happens when she wins the chance to play the game in a real-life setting? A chance to become the main female lead must be a otome gamer's dream. ",2,http://www.mangaupdates.com/series.html?id=123649,0,0,0
Complete,0,0,1,0,0,1,0,0,0,1,0,0,0,0,0,0,0,1,0,0,0,0,0,"Comedy, Ecchi, Harem, Mature, Romance, SchoolLife, Shounen",0,1,0,0,0,0,0,Redi x Bato!,1,0,0,"Hino Akiharu lost his parents when he was an elementary student and was taken in by his uncle's family. One day, he sees on the news about the newly-established Hakureiryou Gakuin, a school which was re-built from an elite girls' school. He decides to take the exam for that school and succeeds in entering the House Management Department (the place to train maids & butlers). He wants to become a butler, although his appearance scares the ladies. Akiharu has a sinister look in his eyes, a scar on his right eyebrow, and bristled up hair. Add 3 piercings on his ears and he indeed has a typical bad boy look on him. He meets his ""nemesis"" at that school, Saikyou Tomomi, a girl with a two faced character who traumatized him many times since they were kids. Another girl named Cernia Iori FlameHeart chases after him because of his looks and calls him suspicious. Still, Akiharu starts finding his feet at the school and his relationships with the girls also get better. ",1,http://www.mangaupdates.com/series.html?id=34332,1,0,0
Ongoing,0,0,1,0,0,1,0,0,0,1,0,0,0,0,0,0,0,1,0,0,0,0,0,"Comedy, Drama, Ecchi, Harem, Mature, Romance, SchoolLife, Shounen",1,1,0,0,0,0,0,Real no Heroine wa Irimasen!,1,0,0,"Aramiya Seiichi is an ordinary high school... eroge otaku who's given up all hope on girls in the 3D world due to a certain incident. One day, after he bought a bunch of new materials in consequence of experiencing the frustration of a perfect eroge character turning out to be ""used goods,"" he encounters a delinquent-like-looking girl being about to get raped by a bunch of guys. By mere chance, he rescues her. Days later, when school starts again, it turns out to have been his classmate, Ayame, a feared delinquent girl who's got all kind of rumors about her—especially that she's ""used goods."" And it appears that she's set on becoming his ideal girl to make him fall for her. ",2,http://www.mangaupdates.com/series.html?id=140177,1,0,0
Ongoing,0,0,1,0,0,1,0,0,0,1,0,1,0,0,0,0,0,1,0,0,0,0,0,"Action, Comedy, Drama, Ecchi, Fantasy, Harem, Romance, Shounen",1,0,0,1,0,0,0,Red Night Eve,1,0,0,"From : Hana, a high-schooler that is known as the cutest girl in school, gets pulled into a supernatural event while on a beach trip with her friends. This event, called a ""Red Night Eve"" involves a transformed extremely massive shark, which targets Hana while she's swimming! Luckily, she's rescued by the siblings Yayako and Yuuto Kagimori, students from her school who know all about these occurrences, and who even have a support program AI named Acacia in their tablet to help them. Not long after, Hana and the siblings are involved in another event, this time involving her precious class pet parakeet being transformed into something monstrous. With all these supernatural events, Hana's life is never going to be the same. ",6,http://www.mangaupdates.com/series.html?id=115374,0,0,0
Ongoing,0,0,0,0,0,0,0,0,0,1,0,1,0,0,0,0,0,0,0,0,1,0,0,"Action, Adventure, Drama, Fantasy, Harem, Mature, Mystery, Seinen",1,1,0,1,1,0,1,Re:Monster,0,0,0,"After his unfortunate death, Tomokui Kanata has been reincarnated as a member of the weakest race, a goblin named Rou. However, Rou has retained his previous life's memories, as well as an ability that allows him to gain strength and abilities from eating. He also possesses a unique evolutionary tree. Now, Rou has made a promise to himself that he would live this life to the fullest. In this alternate world of survival of the fittest, events unfold with competent subordinates and comrades.  ",3,http://www.mangaupdates.com/series.html?id=109745,0,0,0
Complete,0,0,0,0,0,0,0,0,0,1,0,0,0,0,0,0,0,0,0,1,0,0,0,"Adult, Harem, Hentai, SchoolLife",0,0,0,0,0,0,0,Re-Start,0,0,0,"Tomohiro Mikami is a pretty bastardly guy, who is always bitter and hateful. He decides to use some of his ""pals"" to get the nurse teacher Asou and the language teacher Hasegawa into a really... well, messy circumstance. In a tale of corruption and decadence, Mikami will harshly learn that his ""pals"" aren't as loyal as initially advertized... but there is this one glimpse of hope for him, after all the beautiful pair of Asou-sensei and Hasegawa-sensei happen to have grown a little bit too attached to him, despite all of what he has done. 1. Prologue 2-3. Senpai Kouhai 4-10. Re-Start ",1,http://www.mangaupdates.com/series.html?id=41348,1,1,0
Complete,0,0,0,0,0,0,0,0,0,1,0,0,0,0,0,0,0,0,0,1,0,0,0,"Adult, Harem, Seinen",0,0,0,0,1,0,0,Ranpara!,0,0,0,N/A ,3,http://www.mangaupdates.com/series.html?id=21056,0,0,0
Complete,1,0,1,1,0,1,0,0,0,1,0,0,0,0,0,0,0,1,0,0,0,0,0,"Action, Adventure, Comedy, Ecchi, Harem, Historical, Romance, Shounen, Supernatural",0,0,0,1,0,0,1,Rappi Rangai,1,0,0,"This story takes place during the civil war in Japan. There is a mysterious boy with a short horn on his forehead. His life turns upside down after he saves a wanted female ninja, who then tells him that she's his servant and he is an emperor! Soon a few more girls appear in his life and the adventure begins. What will happen to him and what kind of weird and wonderful stories lie in front of the small group is for you to find out. ",9,http://www.mangaupdates.com/series.html?id=6787,0,0,0
Complete,0,0,1,0,0,0,0,0,0,1,0,1,0,0,1,0,0,0,0,0,0,0,0,"Fantasy, Harem, Romance, Shoujo",0,0,0,0,0,0,0,Rakuen Route,0,0,0,"One day, an angel fell from heaven. Along the way, she lost two of her feathers. Now, she is banished from heaven until she can find them, and thus our story begins... ",8,http://www.mangaupdates.com/series.html?id=4165,0,0,0
Ongoing,0,0,1,0,0,0,0,0,0,1,0,1,0,0,0,0,0,0,0,0,0,0,0,"Action, Adventure, Drama, Fantasy, Harem, Romance, Shounen",1,0,0,1,0,0,1,Rain,1,0,0,"The small country Sunkwoll is in a tight spot because it's under attack of the great country Zarmine. But the general, Rain, who's reputed to be an exceptionally gifted swordsman, is against the war and won't enter the battle. But how is one supposed to wage a war like this anyway? ",15,http://www.mangaupdates.com/series.html?id=38313,0,0,0
Complete,0,0,0,0,0,0,0,0,0,1,0,0,0,0,0,0,0,0,0,1,0,0,0,"Adult, Harem, Hentai",0,0,0,0,0,0,0,Rankon,0,0,0,"Toudou Aruma, the youngest of five brothers, has to take care of the house while they are working abroad. But household chores are the least of his problems since he also has to deal with their wives, as well as his stepmother's sister, all living under the same roof. ",1,http://www.mangaupdates.com/series.html?id=97869,0,1,0
Complete,0,0,1,0,0,1,0,0,1,1,0,0,0,0,0,0,0,1,0,0,0,0,0,"Action, Comedy, Ecchi, GenderBender, Harem, Romance, SchoolLife, Shounen, SliceofLife",0,0,0,1,0,1,0,Ranma 1/2,1,0,0,"[From Viz]: Being a teenage martial artist isn't easy, especially for Ranma Saotome, who went through a major transformation on a training mission with his father. After an accidental dunk into a legendary cursed spring in China, Ranma now changes into a girl every time he's splashed with cold water. That would be enough to complicate anyone's life, even without the arranged fiancée who doesn't like him (or says she doesn't) and the constant stream of rivals and suitors for both his male and female forms. What's a half-guy, half-girl to do? ",38,http://www.mangaupdates.com/series.html?id=1049,1,0,0
Complete,0,0,1,0,0,1,0,0,0,1,0,0,0,0,0,0,0,0,0,0,0,0,0,"Comedy, Harem, Romance, Seinen",0,0,0,0,1,0,0,Raimuiro Senkitan Jun,0,0,0,N/A ,2,http://www.mangaupdates.com/series.html?id=27508,0,0,0
Complete,0,0,1,0,0,0,0,0,0,1,0,0,0,0,0,0,0,0,0,0,0,0,0,"Harem, Romance",0,0,0,0,0,0,0,Raimuiro Senkitan - Otome Kaikousu.,0,0,0,N/A ,1,http://www.mangaupdates.com/series.html?id=20320,0,0,0
Complete,1,0,1,0,0,0,0,0,0,1,0,0,0,0,0,0,0,0,0,0,0,0,0,"Harem, Historical, Romance",0,0,0,0,0,0,0,Raimuiro Senkitan - Gakumon no Susume,0,0,0,"It is 1904, 37th year of the Meiji era. Shintaro Umakai, a former diplomat to Russia, has returned to Japan after the outbreak of the Russo-Japanese war. Heart-broken at leaving his beloved Sophia in Russia, Shintaro accepts a teaching position at a mysterious girls school. Only the girls school turns out to be a battleship and his pupils command strange and bizarre powers--powers that may win the war with Russia. Based on an original hentai game by ELF, Shintaro is both charmed and appalled by his winsome students. Yet these girls will come to depend on their sensei for their very survival, and Shintaro must shoulder greater responsibilities in the face of overwhelming heartbreak. For Russia also has a girls school with strange and bizarre powers... ",1,http://www.mangaupdates.com/series.html?id=20319,0,0,0
Ongoing,0,0,0,0,0,1,0,0,0,1,0,0,0,0,0,0,0,0,0,0,0,0,0,"Comedy, Harem, Seinen",0,0,0,0,1,0,0,Radical Hospital,0,0,0,A 4koma manga ,25,http://www.mangaupdates.com/series.html?id=20559,0,0,0
Complete,0,0,1,0,0,1,0,0,0,1,0,0,0,0,0,0,0,0,0,1,0,0,0,"Adult, Comedy, Harem, Romance, SchoolLife, Seinen",0,0,0,0,1,0,0,Rabu Suma,0,0,0,N/A ,3,http://www.mangaupdates.com/series.html?id=21054,1,0,0
Complete,0,0,1,0,0,1,0,0,0,1,0,1,0,0,0,0,0,0,0,1,0,0,0,"Adult, Comedy, Fantasy, Harem, Romance, SchoolLife, Seinen",0,0,0,0,1,0,0,Raijin - Ikazuchi,0,0,0,N/A ,2,http://www.mangaupdates.com/series.html?id=69530,1,0,0
Complete,0,0,0,0,0,1,0,0,0,1,0,0,0,0,0,0,0,0,0,1,0,0,0,"Adult, Comedy, Harem, Seinen",0,0,0,0,1,0,0,Rabuyu!,0,0,0,N/A ,4,http://www.mangaupdates.com/series.html?id=50477,0,0,0
Complete,0,0,1,0,0,1,0,0,0,1,0,0,0,0,0,0,0,1,0,0,0,0,0,"Comedy, Ecchi, Harem, Romance, Seinen",0,0,0,0,1,0,0,Rabuho Ikou yo,0,0,0,"From DrCoke at : It's been three months since they began to date. They have yet to take their relationship beyond holding hands. Now, for the first time in his life, Tatsuya walks the path towards a hotel with his girlfriend, Kaori, expecting to graduate from virginity. What he doesn't know is that Kaori has a secret... A love-comedy story centered around what the Japanese call ""love"" hotels and this cute couple whose secrets will be revealed as they deepen their relationship! ",3,http://www.mangaupdates.com/series.html?id=16483,0,0,0
Complete,0,0,0,0,0,1,0,0,0,1,0,0,0,0,0,0,0,0,0,1,0,0,0,"Adult, Comedy, Harem, Seinen",0,0,0,0,1,0,0,Quojuz,0,0,0,"From : Three 20-something sisters, Ayame, Kaede and Sumomo, have just about had it with men. Ayame walked in on her husband's infidelity, only to have him leave her for the other woman. Kaede had a crush on a colleague, only to find out he was sleeping with his high school students and keeping a porn stash of their pictures. Sumomo just can't seem to find a guy that's good enough for her. Their lives change the day their little brother Mikio comes to Tokyo to live with them, just after high school graduation. They all become immediately infatuated and aggressively sexual with him. Mikio wishes they would just act like normal sisters, especially since they seem hellbent on ruining his budding relationship with a cute girl named Midori. Will Mikio be able to have a real relationship with a girl, or will his three housemates have their way with him? ",2,http://www.mangaupdates.com/series.html?id=16727,0,0,0
Complete,0,0,1,0,0,1,0,0,0,1,0,0,0,0,0,0,0,0,0,1,0,0,0,"Adult, Comedy, Harem, Romance, Seinen",0,0,0,0,1,0,0,Que Sera Sera (TAMAKOSHI Hiroyuki),0,0,0,"The main character lives more or less a secluded life working as an ero mangaka... Suddently his younger sister Sora arrives at his home, telling him that their father has left a goodbye note and is nowhere to be found.... Their mother is long gone, so being the only relative that can take responsibility for her our hero decides to take care of Sora and provide her with shelter and a shoulder to rely on. Early on, the main character investigates a little, and realizes that he and Sora have no blood relationship at all... He decides to kept this little tidbit to himself sans Sora would be truly be left without any family left. Of course, in order to complete the set up, we have that Sora has a massive brother complex, and that she gets obviously jealous whenever her brother seems to get a good mood with his long time love interest. We have that they will need to survive some big hurdles that will pop up on the long road in order to stay a family, with way more problems that they could ever foresee. Will their ""brother and sister"" relationship truly last forever? ",4,http://www.mangaupdates.com/series.html?id=17988,0,0,0
Complete,0,0,1,0,0,0,0,0,0,1,1,0,0,0,0,0,0,0,0,0,1,0,0,"Action, Harem, Josei, Mystery, Romance",0,0,0,1,0,0,0,QB Karin - Keishichou Tokushu SP-ban,0,0,0,"The title character is a female police inspector, and she is part of a special police unit with six ikemen (handsome) men who protect female VIPs. ",4,http://www.mangaupdates.com/series.html?id=50250,0,0,0
Complete,0,0,1,0,0,1,0,0,0,1,0,0,0,0,0,0,0,0,0,1,0,0,0,"Adult, Comedy, Harem, Romance, SchoolLife, Seinen",0,0,0,0,1,0,0,Puremia,0,0,0,N/A ,6,http://www.mangaupdates.com/series.html?id=98326,1,0,0
Complete,0,0,1,0,0,1,0,0,0,1,0,0,0,0,0,0,0,0,0,1,0,0,0,"Adult, Comedy, Harem, Romance, Shounen",0,0,0,0,0,0,0,Puttsun Meiku Love,1,0,0,N/A ,8,http://www.mangaupdates.com/series.html?id=8747,0,0,0
Complete,0,0,1,0,0,1,0,0,0,1,0,0,0,0,0,0,0,1,0,0,0,0,0,"Comedy, Ecchi, Harem, Romance, Shounen",0,0,0,0,0,0,0,Puripuri,1,0,0,"From DrMaster: All he ever hoped for was to be one step closer to becoming a priest, but Masato Kamioda gets more than he bargained for when he suddenly finds himself as the only male student in a pilot program at an all-girls divinity school. ",11,http://www.mangaupdates.com/series.html?id=1951,0,0,0
Complete,0,0,0,0,0,0,0,0,0,1,0,0,0,0,0,0,0,0,0,1,0,0,0,"Adult, Harem, Hentai, SchoolLife",0,0,0,0,0,0,0,Pura-Tina +,0,0,0,N/A ,1,http://www.mangaupdates.com/series.html?id=59830,1,1,0
Complete,0,0,1,0,0,0,0,0,0,1,0,0,0,0,0,0,0,0,0,1,0,0,0,"Adult, Harem, Hentai, Romance",0,0,0,0,0,0,0,Puri Puro,0,0,0,Kiyoshi is eating and watching TV that suddenly a guest arrives. The princess of Kokiyuki Mataka Kingdom! She has come to fulfill an old promise... #1 Opening Bell #2 First Wedding #3 Second Wedding #4 Third Wedding #5 Fourth Wedding #6 Fifth Wedding #7 Wedding Bell #8 Spinoff 1 The Princess of Dreamland #9 Spinoff 2 Side Effect ,1,http://www.mangaupdates.com/series.html?id=25654,0,1,0
Complete,0,0,0,1,0,0,0,0,0,1,0,0,0,0,0,0,0,0,0,1,0,0,0,"Adult, Harem, Hentai, Supernatural",0,0,0,0,0,0,0,Purimu no Nikki,0,0,0,"A guy dreams that he's a having sex with what appears to be a beautiful cosplayer. He reads the name on her choker, ""Purimu"", and she calls him her master. He wakes up and finds out the dream was real. He runs away from her, thinking that she's a prostitute trying to find a new customer and will have him killed later. After that, he has sex with her on a rooftop and discovers she's not human- she's a succubus (pleasure demon). ",2,http://www.mangaupdates.com/series.html?id=35104,0,1,0
Complete,0,0,0,0,0,0,0,0,0,1,0,0,0,0,0,0,0,0,0,1,0,0,0,"Adult, Harem, Hentai",0,0,0,0,0,0,0,Puri Puri Mermaid,0,0,0,N/A ,2,http://www.mangaupdates.com/series.html?id=71720,0,1,0
Ongoing,0,0,1,0,0,1,0,0,0,1,0,1,0,0,0,0,0,1,0,0,0,0,0,"Comedy, Ecchi, Fantasy, Harem, Romance, SchoolLife, Shounen",0,0,0,0,0,0,0,Puchi Houndo,1,0,0,"There are some days when it'd be better to just stay in bed... so says Kazuma, an apprentice demon-hunter, on the day when he finds a strange creature in the forest. It's not a bloodthirsty monster, but a young half-human, half-dog girl. Just what type of creature is she? And why does Kazuma sees her at his school right after escaping from the encounter? ",10,http://www.mangaupdates.com/series.html?id=13631,1,0,0
Complete,0,0,1,0,0,1,0,0,0,1,0,1,0,0,0,0,0,1,0,0,0,0,0,"Action, Comedy, Ecchi, Fantasy, Harem, Mature, Romance, Shounen",0,1,0,1,0,0,0,Princess wa Mimodaeru,1,0,0,"A boy that was about to die in an accident finds himself summoned to another world to replace the dead king - the only man in the kingdom of women. To return back, he has to finish one task - to make lots of children. ",3,http://www.mangaupdates.com/series.html?id=33929,0,0,0
Complete,0,0,1,1,0,0,0,0,0,1,0,1,0,0,1,0,0,0,0,0,0,0,0,"Fantasy, Harem, Romance, Shoujo, Supernatural",0,0,0,0,0,0,0,Princess Nightmare,0,0,0,"From : For her birthday present, she wishes she could be an ordinary girl. She commutes to Rose Academy in Usuyami Town. She is Little, a beautiful 114-year-old vampire. Her brother Radou watches her, there's a werewolf servant Inukai, and the magical boy Shinji. The ghost that threatens Little's school life has appeared. Adapted from the otome game: Princess Nightmare ",2,http://www.mangaupdates.com/series.html?id=38938,0,0,0
Complete,0,0,1,0,0,1,0,0,0,1,0,0,0,0,0,0,0,1,0,0,0,0,0,"Comedy, Drama, Ecchi, Harem, Romance, Shounen",1,0,0,0,0,0,0,Princess Lover! - Eternal Love for My Lady,1,0,0,N/A ,1,http://www.mangaupdates.com/series.html?id=55473,0,0,0
Complete,0,0,1,0,0,1,0,0,0,1,0,0,0,0,0,0,0,1,0,0,0,0,0,"Comedy, Ecchi, Harem, Mature, Romance, SchoolLife, Seinen",0,1,0,0,1,0,0,Princess Lover! - Pure My Heart,0,0,0,"Teppei Arima is a second-year high school student who lost both of his parents in a traffic accident on their way home from a family trip. His grandfather, Isshin Arima, happens to wield the puppet strings in Japan’s vast economy and demands that Teppei becomes his successor as the head of the Arima Group. To prepare for his debut into high society, Teppei enrolls in an elite academy for the scions of the rich and powerful. ",1,http://www.mangaupdates.com/series.html?id=46626,1,0,0
Complete,0,0,1,0,0,1,0,0,0,1,0,0,0,0,0,0,0,1,0,0,0,0,0,"Comedy, Drama, Ecchi, Harem, Romance, Seinen",1,0,0,0,1,0,0,Princess Lover!,0,0,0,"Teppei Arima is a second-year high school student who lost both of his parents in a traffic accident on their way home from a family trip. His grandfather, Isshin Arima, happens to wield the puppet strings in Japan’s vast economy and demands that Teppei becomes his successor as the head of the Arima Group. To prepare for his debut into high society, Teppei enrolls in an elite academy for the scions of the rich and powerful. ",1,http://www.mangaupdates.com/series.html?id=46247,0,0,0
Complete,0,0,1,0,0,0,0,0,0,1,0,0,0,0,1,0,0,0,0,0,0,0,0,"Harem, Romance, SchoolLife, Shoujo",0,0,0,0,0,0,0,Primo Prima!,0,0,0,"From : Himesato Ui has just enrolled in her late mother's old high school, Shinomiya Academy, as a first year! Hatsu's mother was known as ""Prima"", the most beautiful girl, in the Academy. Ui was full of hope and expectations in enrolling in the Academy, but she was puzzled by the Academy's system of evaluation for students was by a point system. Furthermore, in the school, she met an unknown pretty boy?! ",3,http://www.mangaupdates.com/series.html?id=102609,1,0,0
Complete,0,0,1,1,0,1,0,0,0,1,0,0,0,0,0,0,0,1,0,0,0,0,0,"Comedy, Ecchi, Harem, Mature, Romance, Shounen, Supernatural",0,1,0,0,0,0,0,Princess Lucia,1,0,0,"Koizumi Yuta is a 14-year-old boy who has quite a bit of a problem. The demon princess of the magical world, Lucia, has to procreate with him. That child would have the ability to engulf the entire world for seven whole days. Mikamoto El and Kasukabe Rie are the two angels assigned to make sure that doesn't happen. Kasukabe Rie happens to be the girl he likes. Just how is he going to survive this ordeal? Note: Included in the limited fourth volume edition is a special collaboration booklet (comic) between Princess Lucia and . ",5,http://www.mangaupdates.com/series.html?id=33554,0,0,0
Ongoing,0,0,1,1,0,1,0,0,0,1,0,0,0,0,0,0,0,1,0,0,0,0,0,"Comedy, Ecchi, Harem, Romance, Supernatural",0,0,0,0,0,0,0,Popopo no Onee-san,0,0,0,N/A ,1,http://www.mangaupdates.com/series.html?id=118389,0,0,0
Complete,0,0,0,1,0,1,0,0,0,1,0,0,0,0,0,0,0,0,0,1,0,0,0,"Adult, Comedy, Harem, SchoolLife, Seinen, Supernatural",0,0,0,0,1,0,0,Pinku de Pinku,0,0,0,"Sanada Akihito, a student from Yotsuho Academy has been haunted by the angry spirit of a dead girl. In the exorcism that a friend was trying to do, the spirit manages to possess a girl from Akihito’s class and now that she has a body, she has worldly desires to satisfy in order to move, and Akihito just looks like her previous boyfriend! -- Animexis ",1,http://www.mangaupdates.com/series.html?id=16766,1,0,0
Complete,0,0,0,0,0,0,0,0,0,1,0,0,0,0,0,0,0,0,0,1,0,0,0,"Adult, Harem, Hentai, SchoolLife",0,0,0,0,0,0,0,Pisu Hame!,0,0,0,"Tamao Tsukamu, a second year member of the Kendo-Club, had always a crush on his senpai, Kiratani Konome. One day, after the training, he got asked to help out Kiratani to complete this year's Album for the school council, an Album only available to Girls who participate in it, a VERY Special Album... 1-7. Pisu Hame! 8. Camii Dock! 9. Seiousai Zenjitsu (The Day Before the Saint Cherry Blossom Festival) 1-9. Pisu Hame! Continuation from volume one. - Magazine only. Part of in the tank. ",2,http://www.mangaupdates.com/series.html?id=53561,1,1,0
Complete,0,0,1,1,0,1,0,0,0,1,0,1,0,0,0,0,0,0,0,1,0,0,0,"Adult, Comedy, Fantasy, Harem, Hentai, Romance, Supernatural",0,0,0,0,0,0,0,Power Play!,0,0,0,"The evil sex king, Shadalh, is trying to gather all the beautiful girls in the world to his harem, but the three female magical knights intervene with his plans and his familiar is forced to save him with teleportation magic. In her haste, she mixes up the spell with one of reincarnation. Story continues as in front of ex-evil king, now Sadaharu, a 28 years old virgin amateur H-game designer, his familiar, Sara, falls from the sky and transforms into a brown, silver-haired beauty. ",1,http://www.mangaupdates.com/series.html?id=52735,0,1,0
Complete,0,0,0,0,0,0,0,0,0,1,0,0,0,0,0,0,0,0,0,1,0,0,0,"Adult, Harem, Hentai",0,0,0,0,0,0,0,Pink Shock!,0,0,0,"When a girl claiming to be the descendent of Lui Bei, the founding emperor of the Shu Han state of the ancient Three Kingdoms of China, approaches you because your name is almost identical to said emperor's chancellor and prize strategist, what is a boy to do? Especially when she is very attractive and really, really, really wants you to become her royal strategist as she carves out her destiny? Join in the romp of course, and enjoy the delights offered along the way! ",1,http://www.mangaupdates.com/series.html?id=38002,0,1,0
Complete,0,0,0,0,0,0,0,0,0,1,0,0,0,0,0,0,0,0,0,1,0,0,0,"Adult, Harem, Hentai",0,0,0,0,0,0,0,Pink Trash,0,0,0,1. Sonna Haruda de ne 2. 3-4. Ai da Koi dano Ittenaide 5. (Tanmachi-kun and Hiyoshi-san) 6. (Tsunashima-kun and Ookura-sensei) 7. Sumiyoshi-kun to Kikuna-kun to Ai da Koi dano Ittenaide 8. 9. 10. (The Cat God) 11. Touch & Change ,1,http://www.mangaupdates.com/series.html?id=65520,0,1,0
Complete,0,0,0,0,0,0,0,0,0,1,0,0,0,0,0,0,0,0,0,1,0,0,0,"Adult, Harem, Seinen",0,0,0,0,1,0,0,Pika Pika (KAWAMORI Misaki),0,0,0,N/A ,3,http://www.mangaupdates.com/series.html?id=35203,0,0,0
